{
  "schema_version": "0.1.0",
  "titulo": "Ciclo XV — Eldroth antes da conquista: história social e convivência feérica",
  "estado": "reconstrucao_historico_cultural_proposta",
  "aprovacao_autoral": false,
  "aplicar_ao_canon_automaticamente": false,
  "referencia_regional": "regiao:eldroth",
  "referencia_lugar": "lugar:eldroth",
  "origem_historica": "fontes/autoria/hack-carcaca-dw-capitulo-i.paginas.json",
  "documentacao_previa": "data/worldbuilding/eldroth-ironwood-vandar-ciclo14.json",
  "fontes_com_status": [
    {
      "id": "manuscrito_hack_capitulo_i",
      "arquivo": "fontes/autoria/hack-carcaca-dw-capitulo-i.paginas.json",
      "estado": "rascunho_autoral_transcrito",
      "uso": "referencia_de_mundo_nao_confirmacao_de_propostas"
    },
    {
      "id": "visao_geral",
      "arquivo": "Ambientação - A Carcaça - Visão Geral.txt",
      "estado": "visao_geral",
      "uso": "cronologia_e_regioes"
    },
    {
      "id": "atlas_xiv",
      "arquivo": "data/worldbuilding/eldroth-ironwood-vandar-ciclo14.json",
      "estado": "agenda_editorial",
      "uso": "eixos_e_limites_previamente_levantados"
    }
  ],
  "tese": "Antes de haver ocupação de Sylara, Eldroth já abrigava comunidades élficas, círculos druidas mediadores, relação ritual com seres da mata e, depois de 501 EC, convivência com fadas refugiadas. Uma sociedade não idêntica a reino, templo ou sistema militar.",
  "limites_editoriais": [
    "Nomes de práticas e pactos são títulos editoriais inventados, não nomes de instituições históricas comprovadas.",
    "Nenhuma aldeia, linhagem, tribunal, organização governante, fronteira, rota, população ou data de fundação individual foi inventada como cânone.",
    "Períodos são intervalos para ordenar a análise, não datas de vigência de ritos e práticas propostos.",
    "Refugiados feéricos de 501 EC não se confundem automaticamente com os lordes colonizadores de 666 EC.",
    "A guerra começa em 875 EC; a data da queda de Eldroth e a da posse de Sylara não estão estabelecidas.",
    "Direitos druidas anteriores não equivalem a soberania absoluta de sacerdotes sobre todos os habitantes da mata.",
    "Nenhum pacto listado existiu ou foi assinado; nenhuma vinheta constitui evento de campanha.",
    "Práticas e dados não alteram estatísticas Dungeon World, criaturas, assentamentos, frentes ou mapas canônicos."
  ],
  "contagens": {
    "fases": 4,
    "praticas": 8,
    "pactos": 4,
    "ciclos_materiais": 4,
    "vinhetas": 4,
    "alternativas_em_aberto": 24
  },
  "fases": [
    {
      "id": "worldbuilding-xv:fase:antes-501",
      "chave": "antes_501",
      "inicio_ec": null,
      "fim_ec": 500,
      "titulo": "Antes da chegada das primeiras fadas refugiadas",
      "evidencia": "As comunidades dos elfos da floresta e as práticas druídicas antecedem o domínio shadow fey; a fonte não data a fundação das aldeias.",
      "paginas": [
        17
      ],
      "marco_acontecido": false,
      "limite": "Não fixar a data do primeiro assentamento, dos círculos ou de Vandar."
    },
    {
      "id": "worldbuilding-xv:fase:501-665",
      "chave": "refugio_501_665",
      "inicio_ec": 501,
      "fim_ec": 665,
      "titulo": "Refúgio feérico anterior à migração aristocrática",
      "evidencia": "501 EC marca o início da fuga de fadas; o manuscrito descreve alianças, rivalidades, casamentos, pactos e novas tradições.",
      "paginas": [
        9,
        16,
        17
      ],
      "marco_acontecido": true,
      "limite": "Não fixar que qualquer pacto ou família hipotética tenha sido fundada em 501."
    },
    {
      "id": "worldbuilding-xv:fase:666-874",
      "chave": "convivencia_666_874",
      "inicio_ec": 666,
      "fim_ec": 874,
      "titulo": "Convivência sob a presença crescente da Corte",
      "evidencia": "666 EC marca mudança oficial dos lordes à Carcaça, antes das guerras de conquista começarem em 875 EC.",
      "paginas": [
        9,
        16,
        17
      ],
      "marco_acontecido": true,
      "limite": "Presença de nobres não comprova que Sylara já governava Eldroth antes de 875."
    },
    {
      "id": "worldbuilding-xv:fase:875-transicao",
      "chave": "ruptura_875",
      "inicio_ec": 875,
      "fim_ec": 875,
      "titulo": "Ruptura: começam as guerras de conquista",
      "evidencia": "875 EC é marco da guerra continental; não se presume a data local da queda completa de Eldroth.",
      "paginas": [
        9,
        17
      ],
      "marco_acontecido": true,
      "limite": "O desfecho local e cronologia detalhada da ocupação pertencem ao ciclo XVI."
    }
  ],
  "praticas": [
    {
      "id": "worldbuilding-xv:pratica:roda-das-nascentes",
      "nome_editorial": "Roda das Nascentes sem Dono",
      "tipo": "pratica_social_candidata",
      "estado": "proposta_nao_canonica",
      "fase_de_inspiracao": "antes_501",
      "abrangencia_hipotetica": "mediacao_de_recursos",
      "fontes_ancora": [
        {
          "origem": "manuscrito_hack_capitulo_i",
          "pagina": 17,
          "afirmacao_de_referencia": "Círculos druidas mediavam disputas entre aldeias; a floresta é comunidade e não propriedade do druida.",
          "estado": "registrado_no_rascunho_nao_promovido"
        },
        {
          "origem": "manuscrito_hack_capitulo_i",
          "pagina": 24,
          "afirmacao_de_referencia": "Águas, árvores e estações possuem valor religioso próprio na tradição druídica.",
          "estado": "registrado_no_rascunho_nao_promovido"
        }
      ],
      "eixos_xiv": [
        "worldbuilding-xiv:eixo:sagrado-druidico",
        "worldbuilding-xiv:eixo:subsistencia"
      ],
      "mecanismo_social_proposto": "Decidir compartilhamento de água pelo uso e pela proteção do curso, sem que o círculo se declare proprietário.",
      "vida_cotidiana": "Dois grupos disputam o acesso ao mesmo curso em tempo de necessidade. Alguém precisa permanecer junto da nascente para cuidar do leito enquanto outros transportam água.",
      "costume_ou_rito_hipotetico": "Quem fala diante da nascente escuta primeiro quem chegou a pé de longe e quem mora à sua margem; trata-se de um possível protocolo, não cerimônia documentada.",
      "tensao_interna": "Uma autoridade ritual experiente pode usar sua posição para favorecer o povoado que a alimenta.",
      "pergunta_autoral": "Quem tem o poder de vetar uma decisão sobre uma nascente?",
      "alternativas": [
        {
          "nome": "consentimento_das_comunidades",
          "efeito": "As aldeias afetadas podem recusar uma proposta do círculo.",
          "estado": "nao_escolhida"
        },
        {
          "nome": "veto_do_guardiao",
          "efeito": "O guardião do lugar conserva o poder de impedir uso destrutivo.",
          "estado": "nao_escolhida"
        },
        {
          "nome": "decisao_mista",
          "efeito": "Uma decisão exige acordo dos moradores e observadores do curso d'água.",
          "estado": "nao_escolhida"
        }
      ],
      "existencia_historica_confirmada": false,
      "ritual_observado": false
    },
    {
      "id": "worldbuilding-xv:pratica:tempo-da-caca",
      "nome_editorial": "Tempo dos Rastros Devolvidos",
      "tipo": "pratica_social_candidata",
      "estado": "proposta_nao_canonica",
      "fase_de_inspiracao": "antes_501",
      "abrangencia_hipotetica": "gestao_de_caca_e_coleta",
      "fontes_ancora": [
        {
          "origem": "manuscrito_hack_capitulo_i",
          "pagina": 17,
          "afirmacao_de_referencia": "Druidas administravam períodos de caça e coleta e mantinham pactos com criaturas da floresta.",
          "estado": "registrado_no_rascunho_nao_promovido"
        }
      ],
      "eixos_xiv": [
        "worldbuilding-xiv:eixo:subsistencia",
        "worldbuilding-xiv:eixo:sagrado-druidico"
      ],
      "mecanismo_social_proposto": "Regular não somente a extração, mas a obrigação de deixar viver espécies, filhotes e habitats.",
      "vida_cotidiana": "Caçadores retornam com informações sobre o terreno e encontram famílias cujas reservas não bastam; a data do fechamento da caça pode gerar oposição.",
      "costume_ou_rito_hipotetico": "O último feixe de rastros é mostrado aos jovens para explicar por que certas presas não devem ser perseguidas naquele ciclo.",
      "tensao_interna": "Uma norma necessária ao bosque pode impor fome a quem não possui reservas.",
      "pergunta_autoral": "A escassez autoriza exceções a um período de interdição?",
      "alternativas": [
        {
          "nome": "excecao_de_necessidade",
          "efeito": "Caça limitada para sobrevivência, com dever de reposição.",
          "estado": "nao_escolhida"
        },
        {
          "nome": "proibicao_estrita",
          "efeito": "Habitat permanece protegido mesmo na crise.",
          "estado": "nao_escolhida"
        },
        {
          "nome": "redistribuicao_coletiva",
          "efeito": "Quem dispõe de reservas sustenta os afetados pela interdição.",
          "estado": "nao_escolhida"
        }
      ],
      "existencia_historica_confirmada": false,
      "ritual_observado": false
    },
    {
      "id": "worldbuilding-xv:pratica:lugar-que-nao-se-edifica",
      "nome_editorial": "O Lugar onde Não se Edifica",
      "tipo": "pratica_social_candidata",
      "estado": "proposta_nao_canonica",
      "fase_de_inspiracao": "antes_501",
      "abrangencia_hipotetica": "jurisdicao_sagrada",
      "fontes_ancora": [
        {
          "origem": "manuscrito_hack_capitulo_i",
          "pagina": 17,
          "afirmacao_de_referencia": "Druidas preservavam áreas onde nenhum povo deveria construir.",
          "estado": "registrado_no_rascunho_nao_promovido"
        },
        {
          "origem": "manuscrito_hack_capitulo_i",
          "pagina": 17,
          "afirmacao_de_referencia": "Uma clareira pode ser praça, árvore memorial e trilha estrada comunitária.",
          "estado": "registrado_no_rascunho_nao_promovido"